{
  "$schema": "https://json-schema.org/draft/2020-12/schema",
  "$id": "sample-essay.schema.json",
  "title": "Sample Essay",
  "type": "object",
  "required": ["sample_id", "exam_type", "module", "topic", "band", "essay_text", "rubric_scores"],
  "properties": {
    "sample_id": { "type": "string", "pattern": "^(CET4|CET6|PG)-writing-\\d{3}-\\d{3}$" },
    "exam_type": { "enum": ["CET4", "CET6", "POSTGRADUATE_ENGLISH"] },
    "module": { "const": "writing" },
    "topic": { "type": "string", "minLength": 1 },
    "band": { "type": "string" },
    "prompt": { "type": "string" },
    "essay_text": { "type": "string", "minLength": 50 },
    "word_count": { "type": "integer", "minimum": 50 },
    "rubric_scores": {
      "type": "object",
      "required": ["task_completion", "structure_logic", "language_accuracy", "expression_richness", "total", "max"],
      "properties": {
        "task_completion": { "type": "integer", "minimum": 0 },
        "structure_logic": { "type": "integer", "minimum": 0 },
        "language_accuracy": { "type": "integer", "minimum": 0 },
        "expression_richness": { "type": "integer", "minimum": 0 },
        "total": { "type": "integer", "minimum": 0 },
        "max": { "type": "integer", "minimum": 1 }
      }
    },
    "annotations": {
      "type": "array",
      "items": {
        "type": "object",
        "required": ["highlight", "comment"],
        "properties": {
          "highlight": { "type": "string", "minLength": 1 },
          "comment": { "type": "string", "minLength": 1 },
          "dimension": { "enum": ["task_completion", "structure_logic", "language_accuracy", "expression_richness"] }
        }
      }
    }
  }
}
